<?xml version="1.0" encoding="UTF-8"?>
<!-- edited with XMLSpy v2011 rel. 2 (http://www.altova.com) by imtim (imtim company) -->
<!--W3C Schema generated by XMLSpy v2011 rel. 2 (http://www.altova.com)-->
<xs:schema xmlns:xs="http://www.w3.org/2001/XMLSchema">
	<xs:element name="rule" type="executableType"/>
	<xs:complexType name="switchType">
		<xs:sequence>
			<xs:element name="condition" type="valueType"/>
			<xs:element name="case" type="caseType" maxOccurs="unbounded"/>
			<xs:element name="default" type="executableType" minOccurs="0"/>
		</xs:sequence>
	</xs:complexType>
	<xs:complexType name="daysfromeasterType">
		<xs:choice>
			<xs:element ref="date" minOccurs="0"/>
		</xs:choice>
	</xs:complexType>
	<xs:element name="datebydaysfromeaster" type="intOutputType"/>
	<xs:element name="getclosestday" type="getClosestDayType"/>
	<xs:complexType name="modifydayType">
		<xs:sequence>
			<xs:element ref="getclosestday" minOccurs="0"/>
			<xs:element ref="date" minOccurs="0"/>
			<xs:element ref="datebydaysfromeaster" minOccurs="0"/>
			<xs:element name="modifyreplacedday" minOccurs="0">
				<xs:complexType>
					<xs:complexContent>
						<xs:extension base="modifydayType">
							<xs:attribute name="kind" use="required">
								<xs:simpleType>
									<xs:restriction base="xs:string">
										<xs:enumeration value="menology"/>
										<xs:enumeration value="triodion"/>
									</xs:restriction>
								</xs:simpleType>
							</xs:attribute>
						</xs:extension>
					</xs:complexContent>
				</xs:complexType>
			</xs:element>
		</xs:sequence>
		<xs:attribute name="asaddition" type="xs:boolean" use="optional"/>
		<xs:attribute name="daymove" type="xs:byte" use="optional"/>
		<xs:attribute name="shortname" type="xs:string" use="optional"/>
		<xs:attribute name="priority" type="xs:int" use="optional"/>
		<xs:attribute name="islastname" type="xs:boolean"/>
		<xs:attribute name="usefullname" type="xs:boolean"/>
	</xs:complexType>
	<xs:complexType name="valueType">
		<xs:choice>
			<xs:element name="daysfromeaster" type="daysfromeasterType" minOccurs="0"/>
			<xs:element ref="date" minOccurs="0"/>
			<xs:element name="int" type="xs:int" minOccurs="0"/>
			<xs:element name="getclosestday" type="getClosestDayType" minOccurs="0"/>
			<xs:element name="getdayofweek" minOccurs="0">
				<xs:complexType>
					<xs:complexContent>
						<xs:extension base="getdayofweekType"/>
					</xs:complexContent>
				</xs:complexType>
			</xs:element>
		</xs:choice>
	</xs:complexType>
	<xs:complexType name="getdayofweekType">
		<xs:sequence>
			<xs:element ref="date" minOccurs="0" maxOccurs="unbounded"/>
			<xs:element name="getclosestday" type="getClosestDayType" minOccurs="0" maxOccurs="unbounded"/>
		</xs:sequence>
		<xs:attribute name="name" type="xs:string" use="optional"/>
	</xs:complexType>
	<xs:complexType name="valuesType">
		<xs:sequence>
			<xs:element name="daysfromeaster" type="daysfromeasterType" minOccurs="0" maxOccurs="unbounded"/>
			<xs:element ref="date" minOccurs="0" maxOccurs="unbounded"/>
			<xs:element name="int" type="xs:int" minOccurs="0" maxOccurs="unbounded"/>
			<xs:element name="getclosestday" type="getClosestDayType" minOccurs="0" maxOccurs="unbounded"/>
			<xs:element name="getdayofweek" type="getdayofweekType" minOccurs="0" maxOccurs="unbounded"/>
		</xs:sequence>
	</xs:complexType>
	<xs:complexType name="caseType">
		<xs:sequence>
			<xs:element name="values" type="valuesType"/>
			<xs:element name="action" type="executableType"/>
		</xs:sequence>
	</xs:complexType>
	<xs:complexType name="executableType">
		<xs:sequence maxOccurs="unbounded">
			<xs:element name="modifyday" type="modifydayType" minOccurs="0" maxOccurs="unbounded"/>
			<xs:element name="switch" type="switchType" minOccurs="0" maxOccurs="unbounded"/>
			<xs:element name="if" type="ifType" minOccurs="0" maxOccurs="unbounded"/>
			<xs:element name="service" minOccurs="0" maxOccurs="unbounded">
				<xs:complexType>
					<xs:complexContent>
						<xs:extension base="executableType">
							<xs:attribute name="time" type="xs:string" use="optional"/>
							<xs:attribute name="timestyle" type="xs:string" use="optional"/>
							<xs:attribute name="name" type="xs:string" use="required"/>
							<xs:attribute name="namestyle" type="xs:string" use="optional"/>
							<xs:attribute name="isdaybefore" type="xs:boolean" use="optional" default="false"/>
							<xs:attribute name="additionalname" type="xs:string" use="optional"/>
						</xs:extension>
					</xs:complexContent>
				</xs:complexType>
			</xs:element>
			<xs:element name="notice" type="noticeType" minOccurs="0" maxOccurs="unbounded"/>
			<xs:element name="text" type="textType" minOccurs="0" maxOccurs="unbounded"/>
		</xs:sequence>
	</xs:complexType>
	<xs:complexType name="getClosestDayType">
		<xs:choice>
			<xs:element ref="date" minOccurs="0"/>
		</xs:choice>
		<xs:attribute name="dayofweek" use="required">
			<xs:simpleType>
				<xs:restriction base="xs:string">
					<xs:enumeration value="понедельник"/>
					<xs:enumeration value="вторник"/>
					<xs:enumeration value="среда"/>
					<xs:enumeration value="четверг"/>
					<xs:enumeration value="пятница"/>
					<xs:enumeration value="суббота"/>
					<xs:enumeration value="воскресенье"/>
				</xs:restriction>
			</xs:simpleType>
		</xs:attribute>
		<xs:attribute name="weekcount" type="xs:byte" use="required"/>
	</xs:complexType>
	<xs:element name="date" type="xs:gMonthDay"/>
	<xs:element name="daysfromeaster" type="daysfromeasterType"/>
	<xs:element name="int" type="xs:int"/>
	<xs:complexType name="noticeType">
		<xs:attribute name="time" type="xs:string" use="optional"/>
		<xs:attribute name="timestyle" type="xs:string" use="optional"/>
		<xs:attribute name="name" type="xs:string" use="required"/>
		<xs:attribute name="namestyle" type="xs:string" use="optional"/>
		<xs:attribute name="isdaybefore" type="xs:boolean" use="optional" default="false"/>
		<xs:attribute name="additionalname" type="xs:string" use="optional"/>
	</xs:complexType>
	<xs:complexType name="intOutputType">
		<xs:choice>
			<xs:element ref="daysfromeaster" minOccurs="0"/>
			<xs:element ref="int" minOccurs="0"/>
		</xs:choice>
	</xs:complexType>
	<xs:complexType name="textType">
		<xs:sequence>
			<xs:element name="style" type="styleType"/>
			<xs:element name="text"/>
		</xs:sequence>
	</xs:complexType>
	<xs:complexType name="styleType">
		<xs:sequence>
			<xs:element name="red" minOccurs="0" maxOccurs="1"/>
			<xs:element name="bold" minOccurs="0" maxOccurs="1"/>
			<xs:choice minOccurs="0" maxOccurs="1">
				<xs:element name="h1"/>
				<xs:element name="h2"/>
				<xs:element name="h3"/>
				<xs:element name="h4"/>
			</xs:choice>
		</xs:sequence>
	</xs:complexType>
	<xs:complexType name="ifType">
		<xs:sequence>
			<xs:element name="condition" type="boolValueType" minOccurs="1" maxOccurs="1"/>
			<xs:element name="then" type="executableType" minOccurs="1" maxOccurs="1"/>
			<xs:element name="else" type="executableType" minOccurs="0" maxOccurs="1"/>
		</xs:sequence>
	</xs:complexType>
	<xs:complexType name="boolValueType">
		<xs:sequence>
			<xs:element name="equals" type="comparisonType" minOccurs="0"/>
			<xs:element name="more" type="comparisonType" minOccurs="0"/>
			<xs:element name="moreequals" type="comparisonType" minOccurs="0"/>
			<xs:element name="less" type="comparisonType" minOccurs="0"/>
			<xs:element name="lessequals" type="comparisonType" minOccurs="0"/>
		</xs:sequence>
	</xs:complexType>
	<xs:complexType name="comparisonType">
		<xs:sequence>
			<xs:element name="op1" type="valueType"/>
			<xs:element name="op2" type="valueType"/>
		</xs:sequence>
	</xs:complexType>
</xs:schema>
