<?xml version="1.0" encoding="UTF-8"?>
<rule xmlns:xsi="http://www.w3.org/2001/XMLSchema-instance" xsi:noNamespaceSchemaLocation="file:///C:/Users/%d0%9c%d0%be%d0%bd%d0%b0%d1%81%d1%82%d1%8b%d1%80%d1%8c/Documents/programming/XML/Rules/RulesSchema.xsd">
	<if>
		<expression>
			<equals>
				<int>1</int>
				<daysfromeaster>
					<date>--04-04</date>
				</daysfromeaster>
			</equals>
		</expression>
		<then/>
	</if>
</rule>
